publish_date,sentiment,model,model_version,article_hash,raw_response
2025-04-15,Mixed,anthropic,claude-3-5-sonnet-20241022,2dc2ceaef4b0dc4779b920546de8df7a,Mixed
2025-04-21,"April 21, 2025, 9:15 a.m. ET",Mixed,anthropic,claude-3-5-sonnet-20241022,2df5ae03eb07e6e638be698b20f97ecf,Mixed
2025-04-22,"April 22, 2025, 9:16 a.m. ET",Mixed,anthropic,claude-3-5-sonnet-20241022,420d510c053ef407d5aa70daf35b62ac,Mixed
2025-04-23,"April 23, 2025, 9:12 a.m. ET",Bullish,anthropic,claude-3-5-sonnet-20241022,c232970a2c36079c2eaed06e09f4e6e9,Bullish
2025-04-24,"April 24, 2025, 9:05 a.m. ET",Mixed,anthropic,claude-3-5-sonnet-20241022,24f10174fff07fa851bcea5162364f19,Mixed
2025-04-25,"April 25, 2025, 9:05 a.m. ET",Mixed,anthropic,claude-3-5-sonnet-20241022,5b4a6d7e38ba02217ea854a98d891c66,Mixed
2025-04-28,"April 28, 2025, 9:09 a.m. ET",Mixed,anthropic,claude-3-5-sonnet-20241022,b543ddaa4305ea33ae32f3591c8e8e67,Mixed
2025-04-30,"April 30, 2025, 9:18 a.m. ET",Mixed,anthropic,claude-3-5-sonnet-20241022,0061a5cd51dedcb3272ea271b429cf64,Mixed
2025-05-01,"May 1, 2025, 9:16 a.m. ET",Mixed,anthropic,claude-3-5-sonnet-20241022,a7284be68a314f836e462a8d923e1d3a,Mixed
2025-05-02,"May 2, 2025, 9:21 a.m. ET",Mixed,anthropic,claude-3-7-sonnet-20250219,6e3374494013537d4d002630015afd98,"Mixed. Key indicators include: 1) Positive job growth above expectations, suggesting economic strength, but 2) Diminished rate cut hopes due to steady unemployment, and 3) Trade war concerns with China and Japan's comments about Treasury holdings creating uncertainty."
2025-05-05,"May 5, 2025, 9:22 a.m. ET",Mixed,anthropic,claude-3-7-sonnet-20250219,05dfca8efdc36b25927ca80d3c24a4a4,"Mixed. Key indicators include the nine-day winning streak for S&P 500 (bullish), but stocks retreated overnight (bearish), and analysts remain bearish on the economy despite the recent rally (cautious sentiment)."
2025-05-06,"May 6, 2025, 9:17 a.m. ET",Mixed,anthropic,claude-3-7-sonnet-20250219,aa249c288fff5bf451cf68b57b2df2f4,"Mixed. Indicators include market decline after nine-session win streak, concerns about trade deals, and mixed performance among Magnificent Seven stocks despite mostly beating expectations."
2025-05-07,"May 7, 2025, 9:11 a.m. ET",Bearish,anthropic,claude-3-7-sonnet-20250219,c865fb98ea362438c121a9f4941c3c16,"Bearish. Key indicators: major indexes showing negative values (-0.64%, -0.24%, -0.74%), warnings about potential ""sell on the news"" reaction to trade developments, and analyst reticence about earnings outlook for remainder of year."
2025-05-08,"May 8, 2025, 9:10 a.m. ET",Bullish,anthropic,claude-3-7-sonnet-20250219,7f9c7e980e2857195dac20c6fcc37e4d,"Bullish. Key indicators: Trump's hint at lifting chip export restrictions, progress on trade agreements with UK and China, and market's ""risk-on"" sentiment returning to crypto and Magnificent Seven stocks."
2025-05-09,"May 9, 2025, 9:06 a.m. ET",Mixed,anthropic,claude-3-7-sonnet-20250219,05ddb1a4bfbf20a9fb6bf28deb3e11a3,"Mixed. Treasury yields leaping, stocks struggling to hold intraday gains, and uncertainty around US-China trade talks with conflicting tariff information creating market volatility."
2025-05-12,"May 12, 2025, 9:19 a.m. ET",Bullish,anthropic,claude-3-7-sonnet-20250219,5b5828a08be3deed1855896baf239156,"Bullish. Key indicators: 1) Wall Street ""wears a rally hat"" with 3% overnight surge due to U.S.-China tariff reductions. 2) Technology and chip stocks leading gains with ""risk-on"" sentiment climbing."
2025-05-13,"May 13, 2025, 9:11 a.m. ET",Bullish,anthropic,claude-3-7-sonnet-20250219,d7df012929af0d2bd0fbd3e8f6b18e20,"Bullish. Rising major indices (+3.26%, +2.81%, +4.35%), reduced recession odds (35% from 45%), and easing trade tensions with China."
2025-05-14,"May 14, 2025, 9:07 a.m. ET",Mixed,anthropic,claude-3-7-sonnet-20250219,bded8d62b21e583e8e16cdab250aced7,"Mixed. Treasury yields rising to one-month highs despite mild CPI, indicating growth hopes but potential inflation concerns. Market rally pushing S&P 500 P/E ratio to 22, suggesting elevated valuations with little risk discount. Earnings season entering final stretch with key companies reporting."
2025-05-15,"May 15, 2025, 9:16 a.m. ET",Mixed,anthropic,claude-3-7-sonnet-20250219,206580eeefe1dbf8907d04407d7771fa,"Mixed. Key indicators: S&P 500 slightly up (+0.10%), Dow Jones down (-0.21%), Nasdaq up (+0.72%)."
2025-05-16,"May 16, 2025, 9:12 a.m. ET",Mixed,anthropic,claude-3-7-sonnet-20250219,4c75cfd979e7fc259200187601a29484,"Mixed. Key indicators: S&P 500 up 4% for the week showing bullish momentum, but renewed tariff concerns and Walmart price increases signal inflation risks, creating a balanced sentiment picture."
2025-05-19,"May 19, 2025, 9:15 a.m. ET",Bearish,anthropic,claude-3-7-sonnet-20250219,59b7c77c106d37337c6a18e8e2bd72d0,"Bearish. Moody's downgrade of U.S. debt, rising Treasury yields (10-year above 4.5%, 30-year above 5%), and falling major indexes and dollar."
2025-05-20,"May 20, 2025, 9:15 a.m. ET",Mixed,anthropic,claude-3-7-sonnet-20250219,55110d86ecdbba4fadab623905c08066,"Mixed. Key indicators: S&P 500 posted sixth straight higher close (+0.09%), but tech stocks underperforming, and concerns about tariff impacts on inflation despite recent benign data."
2025-05-21,"May 21, 2025, 9:09 a.m. ET",Bearish,anthropic,claude-3-7-sonnet-20250219,3ea72b41bbad3fc83920266638a8176a,"Bearish. Rising bond yields, Middle East tensions, and downward revisions to earnings forecasts are creating negative market pressure."
2025-05-22,"May 22, 2025, 9:10 a.m. ET",Bearish,anthropic,claude-3-7-sonnet-20250219,85aa3ffca4e2a0f9c79cd1cca074d9b8,"Bearish. Rising Treasury yields, weak bond auction demand, and deficit concerns impacting markets negatively."
2025-05-23,"May 23, 2025, 9:12 a.m. ET",Mixed,anthropic,claude-3-7-sonnet-20250219,08ab5d76dbdc92d85234fef41a3fcd56,"Mixed. Key indicators: NASDAQ slightly up (+0.28%), S&P 500 slightly down (-0.04%), and new tariff threats causing pre-market volatility with Treasury yields falling."
2025-05-27,"May 27, 2025, 9:10 a.m. ET",Mixed,anthropic,claude-3-7-sonnet-20250219,f75ec3c677aecbf465b39d6d1beeb83b,Mixed. Tariff delay boosting tech stocks but iPhone tariffs still loom. Treasury yields showing volatility with weak auction demand. Consumer confidence remains at historically low levels despite slight expected improvement.
2025-05-28,"May 28, 2025, 9:07 a.m. ET",Bullish,anthropic,claude-3-7-sonnet-20250219,55485919bf4c42c7651b67f9430a6e19,"Bullish. Major indices showing significant gains (NASDAQ +2.05%, Dow +1.78%), strong market rally described as ""buy-the-dip mentality is alive and well."""
2025-05-29,"May 29, 2025, 9:16 a.m. ET",Bearish,anthropic,claude-3-7-sonnet-20250219,dafd9493d603824a037f9d06e32db3a5,"Bearish. Key indicators: negative GDP growth (-0.2%), major indices showing declines (-0.5% to -0.58%), and rising jobless claims (240,000, above expectations)."
2025-05-30,"May 30, 2025, 9:16 a.m. ET",Bullish,anthropic,claude-3-7-sonnet-20250219,1a9d73972734d9c9fa5e8ab7adee5240,"Bullish. Key indicators: positive index values (+0.40%, +0.28%, +0.39%), progress on inflation (PCE as expected), and strong corporate earnings (Ulta Beauty up 9.3%)."
2025-06-02,"June 2, 2025, 9:16 a.m. ET",Mixed,anthropic,claude-3-7-sonnet-20250219,6362e54c80cc0a1b980d44c4ad1b7dd9,"Mixed. Key indicators: Dow Jones up 0.13%, Nasdaq down 0.32%, and S&P 500 (implied by first index) down 0.01%, showing conflicting market directions amid trade tension concerns."
2025-06-03,"June 3, 2025, 9:23 a.m. ET",Bearish,anthropic,claude-3-7-sonnet-20250219,5d8aa07ccd026d1861a4db337f57eaf4,"Bearish. Global growth forecast cut, China manufacturing decline, trade fears and tariffs weighing on markets."
2025-06-04,"June 4, 2025, 9:23 a.m. ET",Mixed,anthropic,claude-3-7-sonnet-20250219,d14ea3f81234b18b1e97e5cae2cfd00a,"Mixed. Key indicators include weak ADP jobs report (only 37,000 positions added vs 115,000 expected), stocks initially rising toward three-month highs but losing momentum, and concerns about US-China trade tensions with increased tariffs."
2025-06-05,"June 5, 2025, 9:20 a.m. ET",Mixed,anthropic,claude-3-7-sonnet-20250219,1bdfd953d5cdbea547515667c18040e3,"Mixed. Key indicators: Major indexes showing divergent performance (Nasdaq +0.01%, Dow -0.22%, S&P +0.32%), rising jobless claims suggesting labor market softening, and market reactions to Trump-Xi call offsetting earlier negative sentiment."
2025-06-06,"June 6, 2025, 9:23 a.m. ET",Mixed,anthropic,claude-3-7-sonnet-20250219,d240e3aaf487cc8fd2000b0b02911601,"Mixed. Key indicators: 1) Jobs growth remained positive at 139,000 but with downward revisions to previous months, 2) Market indices showing slight declines (NASDAQ -0.53%, Dow -0.25%) despite post-jobs report gains."
2025-06-09,"June 9, 2025, 9:08 a.m. ET",Bullish,anthropic,claude-3-7-sonnet-20250219,1a91330e424cbe6937bd0365cbbe5dfb,"Bullish. Key indicators: 1) Major indices showing gains of 1%+ (S&P, Dow, Nasdaq), 2) Better-than-expected May jobs growth, 3) Analyst prediction of S&P 500 testing all-time high."
2025-06-10,"June 10, 2025, 9:05 a.m. ET",Mixed,anthropic,claude-3-7-sonnet-20250219,f045b27b078af717002ec018b0341c8d,"Mixed. Key indicators: Major indexes showing minimal movement (NASDAQ +0.09%, Dow -0.00%, S&P 500 +0.31%), ongoing trade talks between US-China with uncertain outcomes, and investor caution ahead of tomorrow's CPI data and Fed meeting."
2025-06-12,"June 12, 2025, 9:05 a.m. ET",Bearish,anthropic,claude-3-7-sonnet-20250219,ace91078863b958f4789dea443520fc4,"Bearish. Negative market indicators include declining indices (NASDAQ, S&P), rising tensions in Middle East, and tariff concerns with China despite softer inflation data."
2025-06-13,"June 13, 2025, 9:08 a.m. ET",Bullish,anthropic,claude-3-7-sonnet-20250219,bb9343d4440293a601558206a5ab5748,"Bullish. Nasdaq-100 trading above 200-day moving average, potential bullish technical signal with 50-day moving average approaching 200-day crossover, major indexes showing positive gains (+0.24% to +0.38%)."
2025-06-16,"June 16, 2025, 9:10 a.m. ET",Bearish,anthropic,claude-3-7-sonnet-20250219,581b2f8f6ce1a1de7189c57be47c0512,"Bearish. Key indicators: major indexes showing significant declines (-1.13% to -1.79%), Middle East tensions affecting oil markets, and heavy selling reported from previous Friday."
2025-06-17,"June 17, 2025, 9:09 a.m. ET",Mixed,anthropic,claude-3-7-sonnet-20250219,23aa3964de5021de222517f1a94aba7b,"Mixed. Retail sales data showed conflicting signals with overall sales down 0.9% (worse than expected) but the GDP-relevant ""control group"" up 0.4% (better than expected). Geopolitical tensions in the Middle East created market uncertainty, with stocks falling but oil prices rising."
2025-06-18,"June 18, 2025, 9:10 a.m. ET",Mixed,anthropic,claude-3-7-sonnet-20250219,43f1f66ad88ddf52f8e8b8d312ab2454,"Mixed. Indicators include market edging up in early trading but previous day's decline, geopolitical tensions with Iran affecting sentiment, and uncertainty around Fed rate cut projections despite economic slowdown signals."
2025-06-20,"June 20, 2025, 9:19 a.m. ET",Mixed,anthropic,claude-3-7-sonnet-20250219,bad64d496e6c64c92d8a20dcaa7b7cab,"Mixed. Key indicators: 1) Conflicting market movements with some indices down (Nasdaq, Dow) and others up (S&P 500), 2) Fed's mixed signals with unchanged rates but potential July cuts mentioned by Governor Waller."
2025-06-23,"June 23, 2025, 9:04 a.m. ET",Mixed,anthropic,claude-3-7-sonnet-20250219,d3dd6a1df8ee84b4c4f1ffa69afb020d,"Mixed. Conflicting indicators include market shrugging off Iran tensions despite rising VIX (22), stocks recovering early losses despite three straight days of S&P 500 decline, and crude oil surrendering overnight gains despite Middle East conflict."
2025-06-25,"June 25, 2025, 9:07 a.m. ET",Bullish,anthropic,claude-3-7-sonnet-20250219,344946808c0d621982343f3619a8fcb7,"Bullish. Major indices showing significant gains (1.11%-1.43%), tech sector reaching record highs, and improved risk appetite across multiple sectors."
2025-06-26,"June 26, 2025, 9:14 a.m. ET",Bullish,anthropic,claude-3-7-sonnet-20250219,f836677ac2396bf19df3b9953b3899b5,"Bullish. Major indexes rising (S&P 500 approaching all-time highs, Dow up 1.19%), semiconductor stocks gaining on positive Micron earnings, and durable goods orders showing surprising strength."
2025-06-27,"June 27, 2025, 9:10 a.m. ET",Bullish,anthropic,claude-3-7-sonnet-20250219,b6a717d8eeedc2b79724f1eb252b43bb,"Bullish. Rising major indices (+0.80% to +0.97%), broad market rally approaching record highs, and positive semiconductor sector performance despite mixed inflation data."
2025-06-30,"June 30, 2025, 9:14 a.m. ET",Bullish,anthropic,claude-3-7-sonnet-20250219,82852cdce7fb59fd26a149709fdeb6d1,"Bullish. Record highs for S&P 500, positive market momentum erasing previous losses, improved investor sentiment with reduced fear and uncertainty."
2025-07-01,"July 1, 2025, 9:12 a.m. ET",Bullish,anthropic,claude-3-7-sonnet-20250219,56517c4388caf8ae67877de1903803f1,"Bullish. Rising major indexes, fresh all-time highs, and positive market momentum despite political uncertainty."
2025-07-02,"July 2, 2025, 9:13 a.m. ET",Bearish,anthropic,claude-3-7-sonnet-20250219,e336b7c80c25ed41346f23a397e0ad00,"Bearish. Key indicators: weak jobs data (33,000 decline in private-sector jobs), rising Treasury yields despite weak economic data, and continuing jobless claims at three-year highs."
2025-07-03,"July 3, 2025, 9:23 a.m. ET",Mixed,anthropic,claude-3-7-sonnet-20250219,92fa70c7edaa3ad6fad283c56c143651,"Mixed. Key indicators: S&P 500 and Nasdaq reaching record highs (bullish), but VIX remains elevated above 18 (cautious), and mixed index performance with Nasdaq up 0.94% while Dow down 0.02%."
